technique_id,technique_name,alternate_names,portuguese_japanese_name,type,subcategory,belt_level,gi_nogi,ibjjf_legal,description,key_points,common_mistakes,related_techniques,counters
BC_001,Seatbelt Control,Over-Under Back Control,Controle das Costas,control,seatbelt_hooks,white,both,all_belts,"Fundamental back control with one arm over shoulder and one under armpit with hooks","One arm over shoulder (choking side)|One arm under armpit|Gable grip seatbelt|Both hooks inside thighs","Loose seatbelt|Hooks not in|Poor grip|Head not tight","BC_002|BC_003|BC_005","Clearing hooks|Fighting hands|Escaping to side"
BC_002,Body Triangle,Figure-Four Back Control,Triângulo de Pernas,control,body_triangle,blue,both,all_belts,"Back control with legs figure-foured around opponent's torso for maximum control","Figure-four legs around torso|Lock over hip not ribs|Seatbelt grip|Choking arm ready","Locking over ribs|Too loose|Poor seatbelt|Triangle wrong side","BC_001|BC_005|BC_006","Breaking triangle|Escaping to triangle side|Attacking ankle"
BC_003,Hooks In Control,Standard Back Control,Ganchos nas Costas,control,seatbelt_hooks,white,both,all_belts,"Classic back control with both feet hooked inside opponent's thighs","Both feet hooked inside thighs|Seatbelt or double underhooks|Head tight to opponent|Hips connected","Hooks too shallow|No seatbelt|Head away|Hips disconnected","BC_001|BC_002|BC_005","Clearing one hook|Fighting hands|Turning in"
BC_004,One Hook Back,Single Hook Control,Um Gancho,control,one_hook,blue,both,all_belts,"Maintaining back control with only one hook when other is being cleared","One hook secured|Other leg controlling hip or thigh|Strong seatbelt|Work to recover second hook","Losing remaining hook|Weak seatbelt|Not recovering|Giving space","BC_001|BC_003|BC_007","Clearing final hook|Turning|Escaping"
BC_005,Rear Naked Choke,RNC|Mata Leao,Mata Leão / Hadaka-jime,submission,seatbelt_hooks,white,both,all_belts,"King of submissions from back control forearm across throat hand to bicep squeeze","Choking arm forearm across throat|Hand grabs bicep|Other hand behind head|Squeeze while expanding chest","Arm not under chin|Loose grip|Not behind head|Too high","BC_001|BC_006|BC_007","Two hands on arm|Chin defense|Clearing arm"
BC_006,Short Choke,Quick RNC,,submission,seatbelt_hooks,blue,both,all_belts,"Quick variation of RNC targeting front of throat with forearm pressure","Forearm across front of throat|Quick finish variation|Less setup required|Explosive squeeze","Wrong placement|Not tight|Too slow|Loose grip","BC_005|BC_001|BC_008","Chin down|Two on one|Turning"
BC_007,Bow and Arrow Choke,Arco e Flecha,Arco e Flecha,submission,seatbelt_hooks,blue,gi,all_belts,"High percentage gi choke using collar grip and pants stretching like drawing bow","Deep cross collar grip|Same side pants grip|Stretch opponent like bow|Choke with collar pressure","Grip not deep|No pants grip|Not stretching|Loose position","BC_001|BC_005|BC_008","Stripping collar grip|Defending pants|Turning"
BC_008,Collar Choke from Back,Cross Collar,Okuri-eri-jime,submission,seatbelt_hooks,blue,gi,all_belts,"Collar choke from back using cross grips on opponent's lapels","One deep collar grip|Second hand feeds lapel|Cross grip configuration|Squeeze and pull","Grips not deep|Wrong configuration|Loose|Not pulling","BC_007|BC_005|BC_001","Stripping grips|Chin defense|Pulling lapels down"
BC_009,Armbar from Back,Back Mount Armbar,Juji-gatame das Costas,submission,seatbelt_hooks,blue,both,all_belts,"Transitioning to armbar when opponent defends choke from back","When arm is isolated defending choke|Swing leg over for armbar|Control arm throughout|Finish with hip extension","Losing arm|Poor transition|Too much space|No control","BC_001|BC_005|CG_009","Pulling arm|Turning into attacker|Stacking"
BC_010,Triangle from Back,Back Take Triangle,,submission,body_triangle,purple,both,all_belts,"Setting up triangle choke from back control position","Isolate one arm|Swing leg over for triangle|Rotate to front if needed|Finish triangle","Arm not isolated|Loose triangle|Poor rotation|Losing back","BC_002|CG_008|BC_001","Arm defense|Turning|Breaking triangle"
BC_011,Back Maintenance,Hook Recovery,,defense,seatbelt_hooks,white,both,all_belts,"Techniques to maintain back control when opponent is escaping","Maintain tight seatbelt|Recover lost hooks|Follow opponent's movement|Keep head tight","Losing seatbelt|Not following|Giving space|Hooks shallow","BC_001|BC_003|BC_004","Progressive escape|Clearing hooks|Turning"
BC_012,Chair Sit,Wrestling Back Take,,entry,seatbelt_hooks,blue,both,all_belts,"Taking back by sitting to side while maintaining seatbelt from turtle","From turtle with seatbelt|Sit to side (chair sit)|Pull opponent into lap|Insert hooks","Sitting wrong direction|Losing seatbelt|No hooks|Poor timing","TT_008|BC_001|BC_003","Defending sit|Basing|Turning toward"
BC_013,Rolling Back Take,Barrel Roll,,entry,seatbelt_hooks,blue,both,all_belts,"Taking back by rolling with opponent from turtle position","From turtle, secure seatbelt|Roll over your shoulder|Pull opponent with you|Insert hooks during roll","Losing seatbelt during roll|Rolling wrong way|No hooks|Poor timing","TT_008|BC_012|BC_001","Defending roll|Basing out|Countering"
BC_014,Back Escape,Standard Back Escape,Fuga das Costas,escape,seatbelt_hooks,white,both,all_belts,"Fundamental escape from back control protecting choke and clearing hooks","Two hands on choking arm|Fall to underhook side|Clear bottom hook|Turn to guard or side","Falling wrong side|Not defending choke|Slow hook clear|Turning wrong way","BC_001|BC_003|BC_015","Maintaining hooks|Following|Reattacking"
BC_015,Body Triangle Escape,Triangle Back Escape,,escape,body_triangle,blue,both,all_belts,"Escaping back control when opponent has body triangle locked","Fall to side with straight leg|Hook over their ankle|Extend to break|Or turn belly toward them","Wrong side|Not hooking ankle|Weak extension|Slow","BC_002|BC_014|BC_001","Maintaining triangle|Finishing choke|Following"
BC_016,Wrist Lock from Back,Back Mount Wrist Lock,Mão de Vaca,submission,seatbelt_hooks,blue,both,blue_and_above,"Attacking wrist when opponent is defending RNC from back","When opponent grabs your arm defending|Isolate their wrist|Apply wrist hyperflexion|Gradual pressure","Not isolating|Too fast|Wrong angle|Loose","BC_005|BC_001|CG_029","Releasing grip|Hiding wrist|Escaping"
BC_017,Armbar Crucifix Transition,Back to Crucifix,,transition,seatbelt_hooks,purple,both,all_belts,"Transitioning from back control to crucifix when arm is trapped","When arm trapped by leg|Transition to crucifix|Control both arms|Attack from crucifix","Losing back|Poor transition|Not controlling|Slow","BC_001|TT_009|TT_010","Keeping arm free|Escaping|Defending crucifix"
BC_018,Truck Position,Twister Entry,,control,body_triangle,purple,both,all_belts,"Eddie Bravo control position for twister and calf slicer attacks","Legs wrapped around one of opponent's legs|Lockdown style control|Control at waist|Ready for attacks","Loose leg control|Poor position|No twister threat|Giving space","HG_006|TT_010|BC_002","Escaping legs|Defending twister|Turning"
BC_019,Sliding Collar Choke,Clock Choke from Back,Estrangulamento Deslizante,submission,seatbelt_hooks,blue,gi,all_belts,"Collar choke from back sliding grip across throat for finish","Deep collar grip|Slide grip across throat|Use body movement|Squeeze to finish","Grip not deep|Not sliding|Poor angle|Loose","BC_007|BC_008|TT_004","Stripping grip|Chin defense|Turning"
BC_020,Straight Jacket,Double Collar Control,,control,seatbelt_hooks,purple,gi,all_belts,"Controlling both of opponent's lapels from back for maximum control","Feed one lapel under their arm|Control both lapels|Maximum restriction|Attack with chokes","Loose lapel control|Poor feed|Not controlling|Giving space","BC_007|BC_008|BC_001","Stripping lapels|Escaping|Fighting grips"
